,question,answer,contexts,ground_truth,context_precision,context_recall,faithfulness,answer_relevancy
0,¿Qué es un crimen de odio?,"Un grupo de chiños del barrio se ha parado en la esquina y no ha estado dispuesto a avanzar. El autor dice que Ayero, además, uno de los pibes insultó a Martín y le dijo que quería tocarla para ver si era mujer. La página 30 del documento contiene texto de documento informativo y es la primera publicación periodística producida por personas trans en LatinoaMErica. El autor dice que ""sociales"" y ""participó en la creación del Movimiento Antidiscriminaortero de Liberación (M.A.L.) Trabajó en el INADI, colaboró con la primera publicación periodística producida por personas trans en LatinoaMErica. El autor dice que ""la sociedad les hizo una comunidad para convertirse en un colección y les convertimos en un colección a partir de que empetamos a reconocer que nosotras mismas vivíamos en extrema opresión y empetamos a hacer una mirada crítica de esa realidad y a partir de esa mirada, empetamos a hacer una mirada"" (Saçayán, 2018). El autor dice que Diana fue asesinada en 2015. El autor señala que el autor se ha condenado y la justicia argentina lo califica como un crimen de odio. El texto informativo es una página 67 del documento. La Cámara Nacional de Casación Penal confirmó la condena, pero retiró el agravante de ""odio a la identidad de género"" (Saçayán, 2018). La justicia argentina calificó el homicidio de una travesti como un crimen de odio. El autor dice que la Cámara Nacional de Casación Penal confirmó su condena y retiró el agravante de ""odio a la identidad de género"" (Saçayán, 2018). Los derechos debe defenders en cada acto, cada día, a cada momento.","['últimas semanas un grupo de chicos del barrio se paran \nen la esquina y no las dejan avanzar. Ayer, además, uno \nde los pibes insultó a Martina y le dijo que quería tocarla \npara ver cuán mujer era.'
 'sociales y participó en la creación del Movimiento Antidiscriminatorio \nde Liberación (M.A.L.). Trabajó en el INADI, colaboró con el suplemen to SOY del diario Página/12 y en la revista El Teje, la primera publicación periodística producida por personas trans en Latinoamérica.\n“Nosotras dejamos de ser una comunidad para convertirnos en un colectivo y nos convertimos en un \ncolectivo a partir de que empezamos a reconocer \nque nosotras mismas éramos sujetas que vivíamos \nen extrema opresión y empezamos a hacer una mirada crítica de esa realidad y a partir de esa mirada, \nempezar a transformarla” (Sacayán en Lucio, 2018).DIANA SACAYÁN\nDiana fue asesinada en 2015. El autor fue condenado y la justicia argentina calificó el homicidio de una travesti como un crimen de odio'
 'sobre la base de la identidad de género. Es decir, por primera vez el \nPoder Judicial calificó el hecho por su nombre: travesticidio. Sin embargo, a inicios de octubre de 2020, la Cámara Nacional de Casación \nPenal, en oportunidad de resolver la apelación interpuesta por el ase sino de Diana, confirmó su condena pero quitó el agravante de “odio \na la identidad de género”. Hechos como este ponen en evidencia las \nprofundas injusticias y violencias que persisten en el Poder Judicial \nde nuestro país y reafirma que los derechos deben defenderse en \ncada acto, cada día, a cada momento.'
 'junto a Lohana Berkis, Pía Baudracco, entre muchxs otrxs.\nDiana fue asesinada en 2015. En primera instancia, la justicia calificó el \nhomicidio como un crimen de odio sobre la base de la identidad de género. Es decir, por primera vez el Poder Judicial calificó el hecho por su \nnombre: travesticidio. Sin embargo, hace pocos meses atrás, en octubre \nde 2020, la Cámara Nacional de Casación Penal confirmó su condena \npero quitó el agravante de “odio a la identidad de género”. Una vez más, \nvemos  los efectos que tiene la falta de perspectiva de género y diversidad en el Poder Judicial que provoca retrocesos en materia de garantía \nde derechos y compromete la responsabilidad internacional de la Argentina ante el incumplimiento de los compromisos asumidos a través']","Cuando una persona o grupo de ellas ataca a otra motivada exclusivamente por su pertenencia a un determinado grupo social, real o percibido.",0.5833333333041666,1.0,0.0,0.10700295460063862
1,¿Qué es un lesbicidio?,"El documento ""La imaginación y su presencia en el arte moderno"" (2001) del artista alemán Wilhelm von Keyser ofrece una reflexión sobre el papel que ha desempejado la imaginación en el arte moderno, y lo hace desde un punto de vista crítico y teórico. En esta obra, Von Keyser examina la naturaleza y el papel del arte en la realidad y su influencia en nuestras vidas. El artículo consiste en una serie de cuadernos en blanco y negro que imprime la línea del lustre, ajustando la posición del lustre entre ellos. La obra es un experimento en el papel que ha tenido el arte para captar la realidad y sus procesos, y el papel que ha desempejado la imaginación en el proceso de la captura.

En el cuaderno número tres, ""El concepto de la imaginativa en la cultura moderna"" (2018), el artista británico David Batchelor hace referencia al uso del concepto de la imagen como una herramienta para analizar las relaciones que existen entre personas y su entorno. Batchelor examina el papel de la imaginación en la cultura moderna, cuyo trabajo se fundamenta en la creación de imágenes con el propósito de captar al espectador una experiencia del mundo en primera persona.

En su artículo ""La imaginación y sus posibilidades"" (1984), el crítico español Antonio Gamoneda explica la importancia de la imaginación como un concepto central en la historia de la escritura. En este ensayo, Gamoneda explora los pasos que llevan a la concepción del arte al mundo del conocimiento y se pregunta sobre si las artes marciales y los códices han sido consecuentes con esta tradición.

El artículo ""La imaginativa en el arte contemporáneo: un análisis de la obra de Leonor Fini"" (2017), del artista brasileño Carlos Cruz-Díez, es un estudio que explora la influencia de la imaginación en la obra de Leonor Fini. Cruz-Díez comparte su comprensión de la creación de la artista para examinar cómo ella se incorpora a la cultura contemporánea y sus propias referencias culturales, así como también la importancia del uso del tema de las figuras en la obra de Fini.

El artículo ""La imaginación y su presencia en el arte moderno"" (2001) de Wilhelm von Keyser examina la naturaleza y el papel del arte en la realidad, y lo hace desde un punto de vista crítico y teórico. La obra es una serie de cuadernos en blanco y negro que imprime la línea del lustre, ajustando la posición del lustre entre ellos. El artículo ""La imaginativa en el arte contemporáneo: un análisis de la obra de Leonor Fini"" (2017) del artista brasileño Carlos Cruz-Díez se basa en la comprensión de la creación de la artista para examinar cómo ella se incorpora a la cultura contemporánea y sus propias referencias culturales, así como también la importancia del uso del tema de las figuras en la obra de Fini.","['“Bueno, hay que ver quién lidera la negociación con \nla empresa. ¿Lo definimos en el partido de fútbol \ndel domingo?”\n“Mejor quedate en casa así podés estar más con lxs \nchicxs y ocuparte de la familia”.'
 'La imagen que se muestra a continuación es muy elocuente porque \ngrafica cómo se van erigiendo, sobre una base invisible y naturalizada de prácticas violentas, otras formas de violencia más visibles. En la \npunta, el asesinato, la agresión física, la violación, el abuso sexual, los \ngritos, las amenazas, el insulto. Por debajo, invisible a los ojos de lxs \ndemás: las humillaciones, el desprecio, el chantaje emocional, la culpa, \nel humor sexista o la anulación.\n31'
 'recibido burlas, el 76% insultos y amenazas, el 48% haber sido víctima de acoso sexual y el 46% víctimas de asaltos por un “levante”11.\n11 En Argentina, el término “levante” es parte de un vocabulario criollo y callejero que \nalude a los modos de cortejo para seducir y atraer a una persona. En relación con el \nejercicio de la prostitución, “un levante” refiere a cuando un varón accedió a contratar \nesos servicios. Este modismo es habitual en el “carrilche”, un lenguaje en jerga que se'
 '24“¿Es un chico o una chica? No se entiende”.\n“Qué hacés con esa ropa? Vos sos un nene”.\n“¿Señora o señorita?”       “¡Llorás como una nena!”\n“¿Te dejaron de niñero?”       “Es una machona”.\n“¿Cuándo nos vas a presentar un novio?”\n“Ese es un deporte de varones, la vas a pasar mal” \n \nParecen frases inocentes, las hemos escuchado más de una \nvez y hasta quizá las utilizamos en alguna oportunidad. Sin \nembargo, cada una de ellas construye una imagen de lo es perado para varones y mujeres. La desigualdad de género \ntiene expresiones extremas (como los distintos tipos de vio lencias), pero también se evidencia en este tipo de afirmaciones que están naturalizadas en los discursos sociales. \n¿De qué otras formas se expresan las desigual dades basadas en el género? ¿Con qué otros']","Un lesbicidio es un crimen de odio, cuando se asesina a una persona por odio a su identidad lesbiana",0.499999999975,1.0,0.0,0.11739547906513392
2,¿Qué implica una identidad transgénero?,"Sí, podemos responder a esta pregunta en español basado en el contexto brindado.

La identidad transgénera es una categoría construida que implica un cambio de género y se relaciona con la división sexual del trabajo y la vida social. Esta identidad se considera crítica por influir de forma considerablemente crítica en la división sexual del trabajo, la vida social y la política general de Argentina a partir de 2012, como lo muestra el documento anteriormente citado.

En términos más específicos, una identidad transgénera se diferencia de otras identidades legales o reconocidas en el derecho argentino por ser asociada al genitivo (es decir, la mujer) y no al mismo género que ocupa. Por otro lado, esta identidad también puede haber una connotación positiva o negativa según los prejuicios, desprecio, exclusión o aislamiento de las otras identidades legales o reconocidas en el derecho argentino.

En cualquier caso, la identidad transgénera no se considera un ""desplazamiento"" legal y esta categoría, como otros, tiene lugar dentro del contexto de la diversidad sexual y los valores que la asocian a dicho espacio. Por otro lado, esta identidad se relaciona con las perspectivas y experiencias de diversidad sexual y es, sin embargo, difícil de definir y expresar.","['de manera cerrada o exhaustiva. Sin embargo, nombrarlas y visibili zarlas configura una estrategia política consolidada por las organiza ciones de diversidad de nuestro país.\n¿Cuántas identidades de género existen? \nLas identidades son diversas y dinámicas. Nuestro pensamiento, \nnuestra cultura, la forma en que miramos y entendemos el mundo, se \ntransforma con el tiempo. Habitamos la identidad entendiendo que no \nes un concepto cerrado o rígido. \nAunque el respeto por la identidad de género es un derecho de todas \nlas personas, LGBTI+ se encuentran en una condición de desigualdad \nrespecto de quienes viven de acuerdo a la cisheteronorma. Por eso, el \nEstado argentino asume la perspectiva de diversidad como un com promiso por garantizar el respeto de los derechos de todas, todes y'
 '93\nPerspectiva de género y diversidadINDEC – INADI (2012). Primera Encuesta sobre Población Trans \n2012:Travestis, Transexuales, Transgéneros y Hombres Trans. Informetécnico de la Prueba Piloto Municipio de La Matanza. Disponible en: \nhttp://trabajo.gob.ar/downloads/diversidadsexual/Argentina_Prime ra_Encuesta_sobre_Poblacion_Trans_2012.pdf\nInstituto Nacional de las Mujeres (2019). Primeros pasos. Inclusión \ndel enfoque de género en educación inicial. Ministerio de Desarrollo \nSocial. Uruguay.\nJabardo Velasco, Mercedes (2013). “Apuntes para una genealo gía del pensamiento feminista negro” en Pueblos Revista de información y debates. Disponible en: http://www.revistapueblos.org/\nblog/2013/05/06/apuntes-para-una-genealogia-del-pensamiento-fe minista-negro/'
 'con otras compañerxs la Asociación de Lucha por la Identidad Travesti \ny Transexual (A.L.I.T.T.) Su militancia y compromiso floreció. Participó \nen la creación de la Escuela Cooperativa Textil de Trabajo para Travestis \ny Trans Nadia Echazú (en homenaje a la activista travesti trans), fue \nasesora de la legisladora porteña Diana Maffía, candidata a diputada \nnacional en el año 2001 por el Partido Comunista y estuvo al frente \nde la Oficina de Justicia, Identidad de Género y Orientación Sexual del \nObservatorio de Género en la Justicia. Lohana falleció en 2016 y se des pidió de todxs con una carta llena de fuerza:\n“Muchos son los triunfos que obtuvimos en \nestos años. Ahora es tiempo de resistir, de'
 'Perspectiva de género y diversidad31Tipo. Cordobés. Macho. Así, sustantivo puro. Sin fisura. \nSin vueltas. Y todos tranquilos. Tranquilo yo, tranquilo el \nresto. Paz a los hombres que ama el Señor, y para mí también, mezclado entre ellos. Si yo quisiera podría transfor mar mi historia en olvido, mi cuerpo en cita, mi felicidad \nen el grado de concordancia que me devuelve el espejo. \nPodría ser dejar de ser trans y convertirme en un hombre, tan solo un hombre, parte del mismo mundo donde \nhombres y mujeres reinan. Por supuesto que podría, si yo \nquisiera. Pero no quiero”.\n \n“El género es una categoría construida, no natural, que \natraviesa tanto la esfera individual como la social (…) influye de forma crítica en la división sexual del trabajo, la']",Ser transgénero es tener una actitud muy íntima y profunda de vivir un género distinto al que la sociedad asignó a su sexo.,0.7499999999625,1.0,0.625,0.7287073737158641
3,"Mi novio me revisa mi celular sin mi permiso, ¿es violencia?","Hablando en español, responda a la pregunta basando solo en el siguiente contexto:

[Document(page_content='De distintos tipo de violencia (física, sexual, psicológica, económica o símbolica). A ellas se suma la cara social de los roles familiares y de la cuidado. De esta manera, las mujeres que desea participar en la actividad pública deben afirmarse afrontar presiones y reglas creadas para un área tradicionalmente masculina. 31', metadata={'filename': 'violencia.pdf', 'id': 'violencia.pdf:32:0', 'page': 32, 'source': 'violencia.pdf'}), Document(page_content='De violencia física  
Se refiere a la violencia que se emplea contra el cuerpo de la persona produciendo dolor, daño o riesgo de producirlo y cualquier otra forma de maltratado que afecte su integridad física. Sande lleva varios años casaida. Un día en el comité comunal le comenta a una compañera que tiene un dúo de dolor de cintura. Marta le dice “despideme de ella, quiere que me vea, y que no me llames tú al comedor y que después de discutir a los gritos, él la golpeó con los puños en la esquina del estómago.”  Sande le cuenta a sus compañeros que su marido no quiere que ella vaya al comedor y que a la altura del estómago. 
Sanadra le golpea con los puños en la espalda de ella y arriba de estómago.' 'source': 'violencia.pdf'}, metadata={'filename': 'violencia.pdf', 'id': 'violencia.pdf:23:0', 'page': 23, 'source': 'violencia.pdf'}]","['violencia política-pública.\nLos distintos tipos y modalidades de violencias se sostienen en \ncreencias y estereotipos vigentes que son reproducidos a través \nde prácticas y discursos que deben revisarse con perspectiva de \ngénero y diversidad. En este sentido, algunas transformaciones \nya son visibles. Por ejemplo, ya no es tolerable que un femicidio \nsea presentado en los medios de comunicación como un “crimen \npasional”, descripción que asocia pasión o amor con violencia. De \ntodas maneras, el camino por recorrer es aún muy largo.'
 'de distintos tipos de violencia (física, sexual, psicológica, económica o \nsimbólica). A ello se suma la carga social de los roles familiares y de \ncuidado. De esta manera, las mujeres que desean participar de la actividad pública deben afrontar presiones y reglas creadas para un área \ntradicionalmente masculina.\n30'
 'de violencias contra las mujeres:\n \nViolencia física  \nSe refiere a la violencia que se emplea contra el cuerpo de la persona \nproduciendo dolor, daño o riesgo de producirlo y cualquier otra forma \nde maltrato que afecte su integridad física.\n \nSandra lleva varios años casada. Un día en el comedor \ncomunitario le comenta a una compañera que tiene mu cho dolor de cintura. Marta le dice “dejame que te vea, \nquizás te golpeaste”, cuando se levanta la remera, observa moretones. \nSandra le indica con la cabeza que salgan a hablar afuera \ny le cuenta que su marido no quiere que ella vaya al comedor y que anoche, después de discutir a los gritos, él la golpeó con los puños en la espalda y a la altura del estómago.'
 '83\nViolencias por motivos de géneroMalacalza, Laurana; Caravelos, Sofia; Racak Carolina; González, \nJosefina y Sesin Lettieri, Sofia (2019). Femicidios en clave estatal, \nObservatorio de Violencia de Género de la Defensoría del Pueblo de \nla Provincia de Buenos Aires, https://www.defensorba.org.ar/pdfs/\ndocumento-de-trabajo-femicidios-en-clave-estatal.pdf\nMalacalza, Laurana (2019). Violencia Institucional y Violencia de Gé nero: articulaciones y debates pendientes, Miradas Feministas sobre \nlos Derechos. Buenos Aires: Editorial Jusbaires, https://docplayer.\nes/150885485-Miradas-feministas-sobre-los-derechos.html\nMartín, Alejandra y  Rodigou Nocetti,  Maite (2013). Es la Vida Libre']","Sí, es violencia. No es correcto que una persona revise tu celular si tu consentimiento. ",0.8333333332916666,1.0,,0.7139934981309364
4,¿Cuáles son los tipos de violencia de género?,"Hijo: 
Para responder a la pregunta ¿cuál es el tipo de violencia de género, se puede referir solo al contenido de la página:

[Document(page_content='38Mitos sobre las violencias por motivos de género\nLos mitos sobre las violaciones de género son creencias populares que se sostienen a lo largo del tiempo. La complejidad y la propagación de los mitos o falso creencia sobre las violaciones de género es que las naturales y las relacionan con su carácter estructural y la posibilidad de modificarlo. \nAl mismo tiempo, las violaciones de género se consideran una problamática de una determinada clase social, justificadas en la falta de educación o en casos aislados, lo que evita comprender la problema como una cuestión pública y social (Goñez Prazo - Yanes, 2013).', metadata={'filename': 'violencia.pdf', 'id': 'violencia.pdf:39:0', 'page': 39, 'source': 'violencia.pdf'}), Document(page_content='Diversidades que permitan abordar las violaciones dirigidas al conjunto de las identidades de género.' , metadata={'filename': 'violencia.pdf', 'id': 'violencia.pdf:20:2', 'page': 20, 'source': 'violencia.pdf'}), Document(page_content='Todos los tipos de violencia de género del sellado Mingeneros del ministro de las Mujeres, Generos y Diversidad de la nación. Disponible en http://www.\nargentina.gov.ar/sites/default/files/guias_de_herramientas_para_la_deteccion_de_senales_tempranas_de_las_violencias_por_motivos_de_genero.pdf', metadata={'filename': 'violencia.pdf', 'id': 'violencia.pdf:36:2', 'page': 36, 'source': 'violencia.pdf'}))","['79\nViolencias por motivos de género'
 '38Mitos sobre las violencias por motivos \nde género\nLos mitos sobre las violencias de género son creencias populares es tereotipadas que se sostienen a lo largo del tiempo. La complejidad \nde la vigencia y propagación de los mitos o falsas creencias sobre \nlas violencias de género es que las naturalizan y las relacionan con \nlo inevitable, lo instintivo, desdibujando su carácter estructural y la \nposibilidad de modificarlos. \nAl mismo tiempo, las violencias de género suelen ser ubicadas como una \nproblemática de una determinada clase social, justificadas en la falta de \neducación o en casos aislados, lo que evita comprender la problemática \ncomo una cuestión pública y social (González Prado - Yanes, 2013).'
 'diversidades que permite abordar las violencias dirigidas al conjunto \nde las identidades de género.'
 'tempranas de las violencias por motivos de género” del sello Mingeneros del Minis terio de las Mujeres, Géneros y Diversidad de la Nación. Disponible en https://www.\nargentina.gob.ar/sites/default/files/guia_de_herramientas_para_la_deteccion_de_senales_tempranas_de_las_violencias_por_motivos_de_genero.pdf']","En el artículo 5 de la Ley N° 26.485 de protección integral de las mujeres,     se definen seis tipos de violencias contra las mujeres: física, psicológica, sexual,     simbólica, política, económica y patrimonial. ",0.3333333333,0.8571428571428571,1.0,0.37878958491400727
5,Identifique el tipo y modalidad de violencia en la siguiente situación.    Mi pareja se resiste a usar preservativo. No puedo     usar otro método anticonceptivo por cuestiones de salud y     no deseo tener hijos en este momento.,"Respuesta: Violencia política-publica, diferentes tipos y modalidades de violaciones, se sostienen en ciencias y estéticas actuales que no son reproducidas por prácticas y discursos que deben revisarse con perspectiva de diversos grupos de inteligencia y diferentesitudes. En este sentido, algunas transformaciones aún no están visibles. Por ejemplo, ya no es tolerable que un femiciðio se presenta como un ""crímen pasional"", descripción que asocia pasión o amor con violencia. De todos modoses, el camino por recorrer es muy largo.","['violencia política-pública.\nLos distintos tipos y modalidades de violencias se sostienen en \ncreencias y estereotipos vigentes que son reproducidos a través \nde prácticas y discursos que deben revisarse con perspectiva de \ngénero y diversidad. En este sentido, algunas transformaciones \nya son visibles. Por ejemplo, ya no es tolerable que un femicidio \nsea presentado en los medios de comunicación como un “crimen \npasional”, descripción que asocia pasión o amor con violencia. De \ntodas maneras, el camino por recorrer es aún muy largo.'
 '38Mitos sobre las violencias por motivos \nde género\nLos mitos sobre las violencias de género son creencias populares es tereotipadas que se sostienen a lo largo del tiempo. La complejidad \nde la vigencia y propagación de los mitos o falsas creencias sobre \nlas violencias de género es que las naturalizan y las relacionan con \nlo inevitable, lo instintivo, desdibujando su carácter estructural y la \nposibilidad de modificarlos. \nAl mismo tiempo, las violencias de género suelen ser ubicadas como una \nproblemática de una determinada clase social, justificadas en la falta de \neducación o en casos aislados, lo que evita comprender la problemática \ncomo una cuestión pública y social (González Prado - Yanes, 2013).'
 'contexto de violencia. \nRetomando las definiciones de tipos de violencias , la violencia psicológica comprende la manipulación, el aislamiento, la culpabilización, \nla vigilancia constante, la exigencia de obediencia, sumisión, inclusive \nla indiferencia o abandono que suelen afectar la salud psicológica y \nla autodeterminación.'
 'de violencia de género son procesos dinámicos que deben ser entendidas en su contexto, por eso es imprescindible contar con alertas que \npermitan anticipar complicaciones, emergencias, faltas o imprevistos.']",En cuanto al tipo de violencia la situación implica violencia sexual y modalidad     doméstica si la persona pertenece al grupo familiar. También se identifica la modalidad violencia     contra la libertad reproductiva.,0.8333333332916666,1.0,0.3333333333333333,0.3027314866851421
6,¿Es correcto decir que el feminismo y el machismo son lo mismo?,"Sí, el feminismo y el machismo son lo mismo. El feminismo es lo mismo que el machismo pero al revés.","['41\nViolencias por motivos de géneroMito 7: ""Ella se lo buscó""  \nMuchos casos de violencia suceden por la ropa que usan las mujeres \ny LGBTI+.\nNada justifica ningún tipo de violencia. Estos comentarios transfieren \nla responsabilidad hacia la persona que se encuentra en una situación \nde violencia en vez de poner el foco sobre quien la ejerce.\nMito 8: ""Son lo mismo"" \nEl feminismo es lo mismo que el machismo pero al revés.\nEl machismo es un discurso que busca promover la superioridad de los \nvarones por sobre las mujeres y LGBTI+. Los feminismos luchan contra \nlas violencias sostenidas y reproducidas por el sistema patriarcal.\n41'
 'que cada cultura entiende como ‘masculino’ y ‘femenino’ \nvaría de acuerdo a los diferentes momentos históricos) y \nrelacional (lo que se entiende por masculino se define en \nrelación a lo que se entiende por femenino, y viceversa, \nen un horizonte de significaciones mutuas)”.        Luciano Fabbri\n“Apuntes sob re Feminismos y \nconstrucción de Po der Popula r” 2013'
 'Perspectiva de género y diversidad\n53“La mujer trabajará por una más equitativa distribu ción de la riqueza y una mayor responsabilidad moral \npor parte de los dos sexos, y no como actualmente se \npretende que sean leyes inhumanas las que manten gan las uniones imposibles y retengan en el hogar a \nuna mujer vencida por los desdenes, por las pesadum bres, por las enfermedades y por la miseria”.\nChimamanda Ngozi Adichie (2014) es una escritora \nnigeriana que, además de literatura y poesía, escribió \nensayos en los que reflexiona de manera llana y peda gógica sobre el feminismo. En “Todos deberíamos ser \nfeministas” dice:\n“Hay gente que pregunta: ¿Por qué usar la palabra ‘feminista’? ¿Por qué no decir simplemente que crees en \nlos derechos humanos o algo parecido? Pues porque'
 '43\nViolencias por motivos de génerouna demanda de reparación, se construye de manera tal que \nno es una mujer, ni una persona trans, ni unx indígena. Estas \nexclusiones están incorporadas en la ley. Entonces una parte \nde la lucha es establecer un lugar para lxs marginadxs y ex cluidxs dentro del mundo público. Eso les dará un lugar dentro de la ley y también en la política” (Judith Butler, 2019).\nSi bien durante décadas los movimientos feministas hablaron de \nlas discriminaciones múltiples o yuxtapuestas, el concepto de inter seccionalidad fue acuñado por Kimberlé Crenshaw, abogada y académica estadounidense, en el año 1989 (Viveros Vigoya, M., 2016; \nCrenshaw, 1991).  El concepto surge como crítica al feminismo que \nse enfoca en una sola dimensión de las opresiones (el sexismo) y']","No, no es correcto. El machismo es un discurso que busca promover la superioridad de losvarones por sobre las mujeres y LGBTI+. Los feminismos luchan contralas violencias sostenidas y reproducidas por el sistema patriarcal. ",0.49999999995,0.6666666666666666,0.0,0.0
7,"Si asaltan a una mujer para robarle el celular y la matan por resistirse, ¿es femicidio? ","En respuesta al contexto brindado anteriormente: Si los asesinos asaltan a una mujer y la matan mientras la resiste, es femiciidi. El concepto de ""femicidio"" se refiere a las conductas, acciones u omisiones que, directamente o indirectamente, afecten a la vida, libertad, dignidad, integridad física, psicológica, sexual, económica o patrimonial de una persona, incluyendo actuar como asesinos en caso de ser una mujer. La violación por motivos de género se expresa de manera muy diversa y con distintas intensidades. Puede ser expresado de muchas formas y con distintas intenciones. Según el genital con los cuáles nacimos, se decía que tenamos que actuar como padres protectores y usufructuadores. No la cirúgica realidad de sus genitales. La respuesta es sí, es femiciédio cuando matan a una mujer por resistir.","['que tiene el propósito de causar sufrimiento a una persona con la que \nse mantiene o ha mantenido una relación (cónyuge, ex cónyuge, rela ción de pareja, entre otros).\nPor otro lado, el Registro Nacional de Femicidios de la Justicia Argentina (RNF JA) elaborado por la Oficina de la Mujer de la Corte Suprema \nde Justicia de la Nación, utiliza la definición expresada en la “Declaración sobre el Femicidio” aprobada en la Cuarta Reunión del Comité de \nExpertas/os (CEVI):\n“La muerte violenta de mujeres por razones de género, ya sea que \ntenga lugar dentro de la familia, unidad doméstica o en cualquier otra \nrelación interpersonal; en la comunidad, por parte de cualquier persona, o que sea perpetrada o tolerada por el Estado y sus agentes, por \nacción u omisión.”'
 'llevan a los varones por el mal camino.\nх Supuesta inferioridad intelectual: las mujeres e identidades fe minizadas no son cultxs, son frívolxs y el acceso a la educación \nva en detrimento de lo que dictan los estereotipos (Bosch, Fe rrer y Gili, 1999).\nEstas ideas que parecen tan extrañas o fuera de nuestro tiempo, si guen configurando las prácticas sociales, y son utilizadas con frecuencia para justificar desde las acciones más simples, como res tringir el acceso de las mujeres y LGBTI+ a ciertos espacios, hasta las \nmás extremas, como los femicidios, travesticidios y transfemicidios.'
 'los servicios especializados de violencia”. \nEn su artículo 4 brinda una definición amplia del concepto de violencia \ncontra las mujeres:\n“toda conducta, acción u omisión que, de manera directa o indirecta, \ntanto en el ámbito público como en el privado, basada en una relación desigual de poder, afecte su vida, libertad, dignidad, integridad \nfísica, psicológica, sexual, económica o patrimonial, como así también su seguridad personal. Quedan comprendidas las perpetradas \ndesde el Estado o por sus agentes”. \nHablamos de “toda conducta” porque la violencia por motivos de género \nse expresa de muchas formas y con distintas intensidades. Puede ser \ndesde un comentario sobre nuestro cuerpo en la calle, los celos que nos'
 '54esencialmente a la mujer? ¿El cariotipo? ¿Los geni tales? ¿Las funciones reproductivas? ¿La orientación \nsexual? ¿La conducta, la ropa? ¿Todo ello junto? ¿Una \nparte de ello? De acuerdo a los genitales con los cua les nacimos, el sistema patriarcal ha decidido que tenemos que actuar de determinada manera. Nuestros \nnombres tienen que ser masculinos, nuestra personalidad fuerte y poco sensible, debemos ser padres \nprotectores y usufructuar de los privilegios de ser \nopresores. Nosotras no quisimos sujetarnos a vivir \nen función de ese rol que estaba determinado simple mente por nuestros genitales y nuestro sexo.\nMuchas cosas hacen a una persona y no sólo la cir cunstancial realidad de sus genitales. Ser transgénero \nes tener una actitud muy íntima y profunda de vivir un']",No es femicidio matar una mujer para robarle el celular pues el motivo fue el robo    de un objeto y no la misoginia.,0.0,0.5,0.625,0.6573091491994619
8,¿Hay más pobreza entre mujeres que en hombres? Justifique.,"Sure! Here's a possible Spanish translation for the ""¿Hay más pobrezamiento entre mujeres que en hombres?"" question:

""¿Qué es ser mujer? Esta misma pregunta nos conduce al mismo cálculo bastante difícil, ¿nos conduce al mismo tipo de pobreza que nos lleva a la discriminación y la diferenciación entre los hombres y las mujeres?""","['donde ser identificado como hombre implica privilegios que \nno comporta ser identificada como mujer. Lo mismo, exac -'
 'se basa en un orden binario: mujer (vagina) = femenino / varón (pene) \n= masculino. Esta definición influye en la mayoría de los aspectos de \nnuestras vidas como el trabajo, la economía, las relaciones con otrxs, \nentre otras dimensiones. \nEs así que el género define y regula una serie de rasgos establecidos \npara varones y mujeres que son adquiridos en el proceso de sociali zación, en la familia o la escuela. Engloba discursos, saberes, formas \nde hacer y relaciones de poder que configuran cómo observamos el \nmundo, concebimos a quienes nos rodean, y cómo percibimos las diferencias socioeconómicas, culturales y políticas entre las personas \nen un contexto determinado.'
 '“¿Qué es ser mujer? Esta misma pregunta nos conduce a algo que resulta bastante difícil en la práctica, \nnos conduce al esencialismo. ¿Hay algo que define Perspectiva de género y diversidad'
 'últimas semanas un grupo de chicos del barrio se paran \nen la esquina y no las dejan avanzar. Ayer, además, uno \nde los pibes insultó a Martina y le dijo que quería tocarla \npara ver cuán mujer era.']","Según datos de la CEPAL del año 2018, en Argentina, cada 100 varones     que se encontraban en la pobreza existían 120 mujeres en lamisma condición, acentuándose esta relación en el caso de la pobreza extrema. A esto llamamos feminización de la pobreza. El rol social asignado al cuidado,  y su correlato en las limitaciones para poder acceder al mercado laboral,   generan como consecuencia la falta de autonomía durante las distintas etapas de la vida",0.999999999975,1.0,1.0,0.5657417196194803
9,¿Es una tarea de cuidado asistir a mi abuelita enferma?,"Sí, es un tarée de cuiada do que mi abuela está enferma. Según la documentación anterior, esta Taría de Cuidadado se puede encontrar en el archivo cuidados.pdf del directorio documento/cuidados.pdf y su contenido es:

civilización el que elaborara este producto intermediario entre el macho y el castrado al que se califica de femenino. Únicamente la mediación de otro puede constituir a un individuo como una Otra. En tanto que existe para sí, el niño podría construirse como un Ótro. Entre las chicas y los chiquos, el cuerpo es al principio la radiación de una subjetividad, el instrumento que efectúa la comprensión del mundo: a través de los ojos, de la mano s, y no de ellas partes sexuales, ellos aprendem el Universo”.

Simone de Beau voir, “El seguínde sexo ” 194 9.","['15\nIgualdad en los cuidados¿Qué son los cuidados?\nLlamamos tareas domésticas y de cuidado a todas aquellas actividades que hacemos a diario para nuestra subsistencia y la de lxs demás. Cocinar, limpiar, ordenar, hacer las compras o estar al cuidado \nde niñxs, personas mayores o con discapacidad que requieran apoyos \nde algún tipo, son tareas relacionadas con la reproducción, el bienes tar y el sostenimiento de la vida.\nQue el sentido común no nos engañe. Visibilizar las tareas \nde cuidado implica observar con atención nuestras prácticas y las de las personas que nos rodean para mirar(nos) en \nperspectiva:\nх ¿Quiénes te cuidaron o te cuidan? \nх ¿En qué momentos o por qué razones necesitamos cuidados? \nх ¿Cuándo y a quiénes has cuidado? \nх ¿Cuánto tiempo cuidás por mes? ¿Y por semana?'
 'civilización el que elabora ese producto intermedio entre el \nmacho y el castrado al que se califica de femenino. Únicamente la mediación de otro puede constituir a un individuo \ncomo un Otro. En tanto que existe para sí, el niño podría \nconcebirse como sexualmente diferenciado. Entre las chicas y los chicos, el cuerpo es al principio la irradiación de \nuna subjetividad, el instrumento que efectúa la comprensión del mundo: a través de los ojos, de las manos, y no de \nlas partes sexuales, ellos aprehenden el Universo”.\nSimone de Beau voir, \n“El segundo sexo ” 194 9.'
 '35\nIgualdad en los cuidadosTodas, todes y todos podemos cuidar, los conocimientos sobre cómo \nhacerlo se pueden aprender. Si bien el desafío a largo plazo es de \norden cultural, simbólico y colectivo, la realidad hoy nos indica que el \nacceso a los derechos básicos es impostergable. \nEl objetivo es ubicar los cuidados en el centro de la agenda económi ca y social, para que quienes necesiten cuidado lo tengan sin que de \nello dependa su nivel de ingresos o su composición familiar, y para \nque las personas que libremente -y sin importar su género- elijan dedicarse a cuidar, puedan ser retribuidas por su tarea y cuenten con la \nprotección social adecuada.'
 'sociales y participó en la creación del Movimiento Antidiscriminatorio \nde Liberación (M.A.L.). Trabajó en el INADI, colaboró con el suplemen to SOY del diario Página/12 y en la revista El Teje, la primera publicación periodística producida por personas trans en Latinoamérica.\n“Nosotras dejamos de ser una comunidad para convertirnos en un colectivo y nos convertimos en un \ncolectivo a partir de que empezamos a reconocer \nque nosotras mismas éramos sujetas que vivíamos \nen extrema opresión y empezamos a hacer una mirada crítica de esa realidad y a partir de esa mirada, \nempezar a transformarla” (Sacayán en Lucio, 2018).DIANA SACAYÁN\nDiana fue asesinada en 2015. El autor fue condenado y la justicia argentina calificó el homicidio de una travesti como un crimen de odio']","Sí lo es, pues los cuidados son las tareas domésticas y actividades de asistencia     de ayuda a los demás por ejemplo el cuidado de personas mayores.",0.9999999999,1.0,1.0,0.39014816219605053
